{
  "schema": "wfb.package.v1",
  "packageId": "WFB-P2P-CORE-4WF",
  "title": "Procure to Pay (P2P) - 4-Workflow Baseline Spine & Shoppable Enterprise Connectors",
  "constellation": "P2P",
  "executionSemantics": {
    "deterministicRuleResolution": "Declarative predicate and function bindings resolved at package load time against FlowCraft's registered deterministic predicate catalog (not freeform runtime LLM prompts).",
    "mutationTiming": "Versioned package overlays compiled and approved prior to workflow activation; running in-flight workflow instances remain bound to their pinned package hash.",
    "stagingIsolation": "Function Steps (Step 2) stage candidate numbers and receipt slots inside an uncommitted SQLite/PostgreSQL savepoint; if Validation Step (Step 3) or Business Rule Step (Step 4) fails, the savepoint rolls back and routes to the named exception loop."
  },
  "catalogConventions": {
    "bpsRefMeaning": "Business Process Standard (BPS) catalog identifier indexing the 66 enterprise outcome families across the 6 constellations.",
    "catalogFamilyPrefix": "P2P01..P2P10 (Procure-to-Pay outcome families inside the 66-family baseline catalog)",
    "workflowBlockPrefix": "CWFB-<FAMILY>-<ROLE> (Compiled Workflow Block identifier)"
  },
  "bpfWorkflowShopping": {
    "baselineDiagramId": "BPF-CHART // DWG: BOSS-P2P-BASELINE-4WF",
    "regulatedEnterpriseDiagramId": "BPF-CHART // DWG: BOSS-P2P-CUSTOM-8WF",
    "chartingToolUsed": "Archify (lightweight flowchart canvas inside B.O.S.S. used during live discovery sessions; modeling tool only, not the runtime engine)",
    "uiRoutes": [
      "/bpf",
      "/catalog",
      "/workflows"
    ]
  },
  "baselineWorkflowChain": [
    {
      "order": 1,
      "workflowBlockCode": "CWFB-P2P04-REQ",
      "catalogFamilyId": "P2P04",
      "bpsRef": "BPS-101.18",
      "title": "Workflow #1: Purchase Requisition & DOA Approval Tree",
      "silverCdmTable": "p2p.purchase_requisition",
      "inputContract": "Purchase Need (Item/Service Spec, Qty, Cost Center)",
      "outputContract": "Approved Requisition [req_no, status=APPROVED, doa_tier]",
      "returnLoop": "Loop L1 (Req Amend / Reject -> Requisitioner)",
      "haraSockets": {
        "humanSeat": "Department Requisitioner -> Cost-Center Approver ($5k Mgr / $50k Dir / >$50k VP)",
        "agentHarness": "WA-COMMIT (Budget & GL Dimension Validator)",
        "commsChannel": "slackline://p2p-core/req-approval",
        "memorySpine": "p2p.purchase_requisition"
      },
      "governancePins": {
        "pin1DeterministicControls": "requester_id != approver_id && cost_center_budget_remaining >= req_total_usd",
        "pin2IndependentReview": "WA-COMMIT validates GL dimension combination prior to routing DOA approval",
        "pin3AuditableEvidence": "SHA-256 signed requisition approval receipt persisted to p2p.purchase_requisition",
        "pin4NamedHumanApproval": "Named DOA seat sign-off ($5k Mgr / $50k Dir / >$50k VP)"
      },
      "canonicalSteps": [
        {
          "stepOrder": 1,
          "stepType": "1. Manual Step",
          "title": "Submit Requisition Cart (Inventory SKU or Service SOW)",
          "deterministicRule": "req_lines.count >= 1 && cost_center_id != null"
        },
        {
          "stepOrder": 2,
          "stepType": "2. Function Step",
          "title": "Resolve Catalog Vendor Price & GL Cost-Center Dimensions",
          "deterministicRule": "lookup_active_price_tier(item_id, vendor_id, qty)"
        },
        {
          "stepOrder": 3,
          "stepType": "3. Validation Step",
          "title": "Verify Budget Encumbrance & Segregation of Duties (SoD)",
          "deterministicRule": "requester_id != approver_id && gl.available_budget(cost_center_id) >= req_total_usd"
        },
        {
          "stepOrder": 4,
          "stepType": "4. Business Rule Step",
          "title": "Execute DOA Approval Tree Sign-Off -> Emit Approved Requisition",
          "deterministicRule": "route_doa_tier(req_total_usd) -> status == APPROVED ? emit(req_no) : route(Loop_L1)"
        }
      ]
    },
    {
      "order": 2,
      "workflowBlockCode": "CWFB-P2P04-PO",
      "catalogFamilyId": "P2P04",
      "bpsRef": "BPS-101.01",
      "title": "Workflow #2: Purchase Order Generation, Dispatch & Supplier Ack",
      "silverCdmTable": "p2p.purchase_order",
      "inputContract": "Approved Requisition [req_no]",
      "outputContract": "Issued Purchase Order [po_no, status=ISSUED_OPEN] + Expected Receipt Slot",
      "returnLoop": "Loop L2 (PO Change Order / EDI 860 -> Re-Validate DOA & Sync Receiving)",
      "haraSockets": {
        "humanSeat": "Category Buyer (Procurement Seat)",
        "agentHarness": "WA-COMMIT (PO Assembler & EDI/Portal Dispatcher)",
        "commsChannel": "slackline://p2p-core/po-dispatch",
        "memorySpine": "p2p.purchase_order"
      },
      "governancePins": {
        "pin1DeterministicControls": "req.status == APPROVED && vendor.status == ACTIVE",
        "pin2IndependentReview": "Verify PO line total <= approved requisition encumbrance ceiling",
        "pin3AuditableEvidence": "Immutable PO dispatch envelope + encumbrance journal entry",
        "pin4NamedHumanApproval": "Category Buyer release authorization"
      },
      "canonicalSteps": [
        {
          "stepOrder": 1,
          "stepType": "1. Manual Step",
          "title": "Review Approved Req & Confirm Delivery Incoterms / SOW Schedule",
          "deterministicRule": "req.status == APPROVED && buyer_seat_id != null"
        },
        {
          "stepOrder": 2,
          "stepType": "2. Function Step",
          "title": "Stage Provisional PO-##### & Expected Receipt Slot in Savepoint",
          "deterministicRule": "stage_provisional_po(req_no) && stage_wms_expected_receipt(po_no)"
        },
        {
          "stepOrder": 3,
          "stepType": "3. Validation Step",
          "title": "Verify Supplier Dispatch Channel & Payment Terms Before Commit",
          "deterministicRule": "vendor.payment_terms_code in ['NET30', 'NET45', '2_10_NET30'] && po_total_usd <= req_total_usd"
        },
        {
          "stepOrder": 4,
          "stepType": "4. Business Rule Step",
          "title": "Commit PO Savepoint Outbound & Record Supplier Acknowledgment",
          "deterministicRule": "commit_and_dispatch_po(po_no) -> status = ISSUED_OPEN"
        }
      ]
    },
    {
      "order": 3,
      "workflowBlockCode": "CWFB-P2P05-RCV",
      "catalogFamilyId": "P2P05",
      "bpsRef": "BPS-103.02",
      "title": "Workflow #3: Inbound Receiving - Bill of Lading (BOL), Shipper & System GRN",
      "silverCdmTable": "p2p.purchase_receipt",
      "inputContract": "Open PO [po_no] + Carrier Bill of Lading (BOL) + Vendor Shipper/Packing Slip (or Service Entry Sheet)",
      "outputContract": "Posted System Receipt [grn_no, bol_no, packing_slip_no, qty_received]",
      "returnLoop": "Loop L3 (Dock Discrepancy / Quarantine / RTV Return Order)",
      "haraSockets": {
        "humanSeat": "Receiving Dock Clerk (Inventory) / Department Lead (Service)",
        "agentHarness": "WA-FULFILL (BOL/Packing Slip OCR & GRN Ledger Coordinator)",
        "commsChannel": "slackline://p2p-core/receiving-dock",
        "memorySpine": "p2p.purchase_receipt"
      },
      "governancePins": {
        "pin1DeterministicControls": "po.status == ISSUED_OPEN && bol_no != null && packing_slip_no != null",
        "pin2IndependentReview": "Cross-check physical dock scan against PO open line quantity tolerance",
        "pin3AuditableEvidence": "Indexed BOL + Shipper PDF hashes linked to grn_no and GR/IR subledger accrual",
        "pin4NamedHumanApproval": "Receiving Dock Clerk or QA Lead physical sign-off"
      },
      "canonicalSteps": [
        {
          "stepOrder": 1,
          "stepType": "1. Manual Step",
          "title": "Receive Carrier at Dock, Inspect Freight & Capture BOL + Shipper/Packing Slip (or Service Log)",
          "deterministicRule": "bol_no != null && packing_slip_no != null"
        },
        {
          "stepOrder": 2,
          "stepType": "2. Function Step",
          "title": "Index BOL + Shipper PDFs & Stage Goods/Service Receipt Note (GRN) in Savepoint",
          "deterministicRule": "stage_grn_savepoint(po_no, bol_no, packing_slip_no, scanned_lines)"
        },
        {
          "stepOrder": 3,
          "stepType": "3. Validation Step",
          "title": "Verify Received Qty & Lot Against Open PO Line Tolerances",
          "deterministicRule": "qty_received <= po_line.qty_open * 1.05"
        },
        {
          "stepOrder": 4,
          "stepType": "4. Business Rule Step",
          "title": "Post System Receipt (GRN), Update Inventory & Post GR/IR Accrual",
          "deterministicRule": "post_grn(grn_no) && post_subledger_journal('DR Inventory / CR GR_IR_Accrual')"
        }
      ]
    },
    {
      "order": 4,
      "workflowBlockCode": "CWFB-P2P06-3WAY",
      "catalogFamilyId": "P2P06",
      "bpsRef": "BPS-101.17",
      "title": "Workflow #4: Vendor Invoice Capture & Deterministic 3-Way Match",
      "silverCdmTable": "p2p.ap_invoice_3way_match",
      "inputContract": "1) PO [po_no] + 2) System Receipt [grn_no + bol_no + packing_slip_no] + 3) Vendor Invoice [inv_no]",
      "outputContract": "Posted AP Voucher [vch_no, status=READY_FOR_PAYMENT] or Hold Loop L4",
      "returnLoop": "Loop L4 (Price Variance -> routes to WF #2 Buyer Loop L2; Qty/BOL Variance -> routes to WF #3 Receiving Dock)",
      "haraSockets": {
        "humanSeat": "Accounts Payable (AP) Specialist / Controller",
        "agentHarness": "WA-RECONCILE (3-Way Match Engine)",
        "commsChannel": "slackline://p2p-core/3way-match-exceptions",
        "memorySpine": "p2p.ap_invoice_3way_match"
      },
      "governancePins": {